{
  "version": 2,
  "id": "CTX-6eb8b388-5f18-4a19-a9b0-c85de554694e",
  "run_id": "6eb8b388-5f18-4a19-a9b0-c85de554694e",
  "created_at": "2026-09-17T14:13:46Z",
  "included": [
    {
      "ref": "goal",
      "authority": "canonical",
      "trust": "high",
      "privacy": "internal",
      "freshness": "current",
      "score": 1,
      "method": "exact",
      "token_cost": 2,
      "content": "/model",
      "reason": "the run goal; via exact; score 1",
      "level": "L1",
      "truncated": true
    },
    {
      "ref": "repo-map",
      "authority": "reference",
      "trust": "medium",
      "privacy": "internal",
      "freshness": "current",
      "score": 0.55,
      "method": "repo-map",
      "token_cost": 8,
      "content": "prumo-tui (package main)",
      "reason": "repository map for orientation; via repo-map; score 0.55",
      "level": "L1",
      "truncated": true
    },
    {
      "ref": "file:prumo-tui/version.go",
      "authority": "reference",
      "trust": "medium",
      "privacy": "internal",
      "freshness": "2026-09-17T08:57:56Z",
      "score": 0.5,
      "method": "structured",
      "token_cost": 45,
      "reason": "workspace file; via structured; score 0.5",
      "level": "L1"
    },
    {
      "ref": "file:prumo-tui/main.go",
      "authority": "reference",
      "trust": "medium",
      "privacy": "internal",
      "freshness": "2026-09-17T09:23:11Z",
      "score": 0.8,
      "method": "structured",
      "token_cost": 1658,
      "reason": "workspace file; lexically matched the goal; via structured; score 0.8",
      "level": "L1"
    }
  ],
  "estimated_tokens": 1713,
  "pressure": "healthy",
  "level": "L1",
  "policy": "workspace-v2"
}